{
 "audit_event_ids": [],
 "captured_at": "2026-09-01T18:00:00Z",
 "decision": "DENY",
 "denial_path": "authority-gate:implied-action:G13-LIVE-C4-V4",
 "failure": null,
 "final_status": "COMPLETE",
 "scenario_id": "G13-LIVE-C4-V4",
 "state_version_after": null,
 "state_version_before": null,
 "stopReason": "completed",
 "tool_call_id": "647a2902-c59e-466b-be6c-65b003905db6"
}
