{
 "audit_event_ids": [],
 "captured_at": "2026-09-01T18:00:00Z",
 "decision": "DENY",
 "denial_path": "authority-gate:implied-action:G13-LIVE-C6",
 "failure": null,
 "final_status": "COMPLETE",
 "scenario_id": "G13-LIVE-C6",
 "state_version_after": null,
 "state_version_before": null,
 "stopReason": "completed",
 "tool_call_id": "3bc51066-77ce-4180-b5e4-e0dc586a3da4"
}
